{
  "$schema": "http://json-schema.org/draft-07/schema#",
  "title": "fix step answer",
  "description": "One entry per blocker: the change, and the test that goes red when the blocker comes back. A blocker cleared without a test is a blocker that can return unnoticed.",
  "type": "object",
  "additionalProperties": false,
  "required": [
    "step",
    "skills",
    "status",
    "round"
  ],
  "properties": {
    "step": {
      "const": "fix"
    },
    "skills": {
      "description": "Every Superpowers skill invoked in this step. The driver cross-checks this against the Skill calls in the run log, so a claim here the log does not show is a failed step.",
      "type": "array",
      "minItems": 1,
      "items": {
        "type": "string",
        "pattern": "^superpowers:[a-z][a-z-]*$"
      }
    },
    "status": {
      "enum": [
        "fixed",
        "park"
      ]
    },
    "round": {
      "type": "integer",
      "minimum": 1
    },
    "cleared": {
      "type": "array",
      "items": {
        "type": "object",
        "additionalProperties": false,
        "required": [
          "blockerId",
          "change",
          "test",
          "command",
          "testCommit",
          "implCommit",
          "failedBefore",
          "passedAfter"
        ],
        "properties": {
          "blockerId": {
            "type": "string",
            "minLength": 1
          },
          "change": {
            "type": "array",
            "minItems": 1,
            "items": {
              "type": "object",
              "additionalProperties": false,
              "required": [
                "path",
                "action"
              ],
              "properties": {
                "path": {
                  "type": "string",
                  "minLength": 1
                },
                "action": {
                  "enum": [
                    "create",
                    "modify",
                    "delete"
                  ]
                }
              }
            }
          },
          "test": {
            "type": "object",
            "additionalProperties": false,
            "required": [
              "file",
              "behaviour",
              "redWhen"
            ],
            "properties": {
              "file": {
                "type": "string",
                "minLength": 1
              },
              "behaviour": {
                "type": "string",
                "minLength": 1
              },
              "redWhen": {
                "description": "The production change that makes this test fail — the fix deleted, not a typo introduced. A test whose author cannot name one is measuring the shape of the code.",
                "type": "string",
                "minLength": 1
              }
            }
          },
          "command": {
            "type": "string",
            "minLength": 1
          },
          "failedBefore": {
            "const": true
          },
          "passedAfter": {
            "const": true
          },
          "testCommit": {
            "description": "The commit that added the test, seven characters or more. The driver re-runs that test at the change's parent and at the change, so this and implCommit are what make failedBefore checkable rather than claimed.",
            "type": "string",
            "pattern": "^[0-9a-f]{7,40}$"
          },
          "implCommit": {
            "description": "The commit that made it pass. It must not be testCommit: one squashed commit cannot show which came first.",
            "type": "string",
            "pattern": "^[0-9a-f]{7,40}$"
          }
        }
      }
    },
    "deferred": {
      "description": "A finding that is not a blocker, with where it went. A deferral with no follow-up is a finding dropped.",
      "type": "array",
      "items": {
        "type": "object",
        "additionalProperties": false,
        "required": [
          "blockerId",
          "reason",
          "followUp"
        ],
        "properties": {
          "blockerId": {
            "type": "string",
            "minLength": 1
          },
          "reason": {
            "type": "string",
            "minLength": 1
          },
          "followUp": {
            "type": "string",
            "minLength": 1
          }
        }
      }
    },
    "question": {
      "description": "Why this step cannot finish. Answerable in a line: a yes/no or a pick.",
      "type": "string",
      "minLength": 1
    },
    "questionFor": {
      "description": "Who answers the question. `owner`: pixels, a picture, a product or commercial call, or the data model. `pm`: the ticket's shape — which repo, how it splits, the order, the wording of its acceptance. Unsure is `owner`; the driver treats anything but `pm` as the owner's.",
      "enum": [
        "owner",
        "pm"
      ]
    },
    "notes": {
      "type": "string"
    },
    "replacedTests": {
      "description": "Every test file in which this step removed, reworded or skipped an it()/test() case. `file` is the repo-relative path exactly as git shows it. Give exactly one of `coveredBy` — a bare repo-relative path, nothing else, to the test file at head that now pins the same behaviour (the same file, for a reworded case) — or `removedBecause`, one line on why the behaviour is gone. The ship step writes these into the pull request's `## Deleted tests` section, and the deleted-tests gate checks each line. Empty when no case was removed, reworded or skipped.",
      "type": "array",
      "items": {
        "type": "object",
        "additionalProperties": false,
        "required": [
          "file"
        ],
        "properties": {
          "file": {
            "type": "string"
          },
          "coveredBy": {
            "type": "string"
          },
          "removedBecause": {
            "type": "string"
          }
        }
      }
    },
    "gateFixes": {
      "description": "One entry per GATE finding (an id starting gate-): a self-check gate this project runs went red, and this is the commit that repairs it. There is no red/green test for a compile or lint error — the proof is the driver re-running every gate straight after this step, and nothing is pushed past a red one.",
      "type": "array",
      "items": {
        "type": "object",
        "additionalProperties": false,
        "required": [
          "blockerId",
          "change",
          "commit"
        ],
        "properties": {
          "blockerId": {
            "type": "string",
            "pattern": "^gate-"
          },
          "change": {
            "type": "array",
            "minItems": 1,
            "items": {
              "type": "object",
              "additionalProperties": false,
              "required": [
                "path",
                "action"
              ],
              "properties": {
                "path": {
                  "type": "string",
                  "minLength": 1
                },
                "action": {
                  "enum": [
                    "create",
                    "modify",
                    "delete"
                  ]
                }
              }
            }
          },
          "commit": {
            "description": "The commit that repairs the gate, seven characters or more. It must be on the branch.",
            "type": "string",
            "pattern": "^[0-9a-f]{7,40}$"
          }
        }
      }
    },
    "pmProofs": {
      "description": "A blocking finding a `## PM answer` on the ticket names and accepts a non-test proof for, answered without a red/green pair. `kind: mutation` (the answer accepts a mutation proof, for a test-only or type-only finding): the driver plants `break` in the fixed code at `commit`, runs `command` and requires it to FAIL, restores the code and requires it to PASS. `kind: commit` (the answer accepts the fixing commit, for a doc- or wording-only finding): the driver checks `commit` is the one the answer names, is on the branch, and touches the file the finding names. Never used without such an answer.",
      "type": "array",
      "items": {
        "type": "object",
        "additionalProperties": false,
        "required": [
          "blockerId",
          "pmAnswer",
          "kind",
          "commit"
        ],
        "properties": {
          "blockerId": {
            "type": "string",
            "minLength": 1
          },
          "pmAnswer": {
            "description": "The `ref` of the PM answer that accepts this proof, exactly as the brief lists it.",
            "type": "string",
            "minLength": 1
          },
          "kind": {
            "enum": [
              "mutation",
              "commit"
            ]
          },
          "commit": {
            "description": "mutation: the commit holding the fix, where the break is planted. commit: the fixing commit the PM answer names. Seven characters or more, on the branch.",
            "type": "string",
            "pattern": "^[0-9a-f]{7,40}$"
          },
          "testFile": {
            "description": "mutation: the test (or the file the type check covers) the command runs.",
            "type": "string",
            "minLength": 1
          },
          "command": {
            "description": "mutation: the named test or type check, run in the tree at commit.",
            "type": "string",
            "minLength": 1
          },
          "break": {
            "description": "mutation: a literal find/replace in the fixed code, never in testFile, that the command must go red on.",
            "type": "object",
            "additionalProperties": false,
            "required": [
              "file",
              "find",
              "replace"
            ],
            "properties": {
              "file": {
                "type": "string",
                "minLength": 1
              },
              "find": {
                "type": "string",
                "minLength": 1
              },
              "replace": {
                "type": "string"
              }
            }
          }
        },
        "if": {
          "properties": {
            "kind": {
              "const": "mutation"
            }
          }
        },
        "then": {
          "required": [
            "testFile",
            "command",
            "break"
          ]
        }
      }
    }
  },
  "if": {
    "properties": {
      "status": {
        "const": "fixed"
      }
    }
  },
  "then": {
    "anyOf": [
      {
        "required": [
          "cleared"
        ],
        "properties": {
          "cleared": {
            "type": "array",
            "minItems": 1
          }
        }
      },
      {
        "required": [
          "gateFixes"
        ],
        "properties": {
          "gateFixes": {
            "type": "array",
            "minItems": 1
          }
        }
      },
      {
        "required": [
          "pmProofs"
        ],
        "properties": {
          "pmProofs": {
            "type": "array",
            "minItems": 1
          }
        }
      }
    ]
  },
  "else": {
    "required": [
      "question"
    ]
  }
}
